### ISSUE TITLE
No errors but no receipt printed

### ISSUE THREAD

**Issue by auguruk** [xiaohao0576/odoo-epos#1]
Hi,
Thanks for this project. It looks great!

I have a raspberry pi which is running Chromium with Odoo.  I have your server running and configured a usb Epson TM-T88V printer. My config us as follows:

{
    "usb": {
        "type": "usb",
        "address": "/dev/usb/lp0",
        "paper_width": 576,
        "margin_bottom": 120
    },
    "png": {
        "type": "file",
        "address": "/tmp/pic"
    }
}

In Odoo, I have set the ePos printer to 192-168-88-250.ip.hogantech.net:1443/usb and I set the System Parameter point_of_sale.enforce_https = True

I have also mapped the ip address to that hostname in my /etc/hosts and also on my network DNS server.  So when I go to https://192-168-88-250.ip.hogantech.net:1443 in a browser I see:

<img width="528" height="159" alt="Image" src="https://github.com/user-attachments/assets/15f04567-48c0-4928-9748-1cba839e8ed2" />

When I complete a sale, I see communication in tcpdump -i lo port 1443 -n 

08:20:14.237246 IP 192.168.88.250.57926 > 192.168.88.250.1443: Flags [P.], seq 1:96, ack 1, win 802, options [nop,nop,TS val 645677604 ecr 645639924], length 95
08:20:14.237294 IP 192.168.88.250.1443 > 192.168.88.250.57926: Flags [.], ack 96, win 659, options [nop,nop,TS val 645677604 ecr 645677604], length 0
08:20:14.237436 IP 192.168.88.250.57926 > 192.168.88.250.1443: Flags [P.], seq 96:135, ack 1, win 802, options [nop,nop,TS val 645677605 ecr 645677604], length 39
08:20:14.237459 IP 192.168.88.250.1443 > 192.168.88.250.57926: Flags [.], ack 135, win 659, options [nop,nop,TS val 645677605 ecr 645677605], length 0
08:20:14.238233 IP 192.168.88.250.1443 > 192.168.88.250.57926: Flags [P.], seq 1:40, ack 135, win 659, options [nop,nop,TS val 645677605 ecr 645677605], length 39
08:20:14.238506 IP 192.168.88.250.1443 > 192.168.88.250.57926: Flags [P.], seq 40:101, ack 135, win 659, options [nop,nop,TS val 645677606 ecr 645677605], length 61
08:20:14.238827 IP 192.168.88.250.57926 > 192.168.88.250.1443: Flags [.], ack 101, win 802, options [nop,nop,TS val 645677606 ecr 645677605], length 0
08:20:14.244374 IP 192.168.88.250.57926 > 192.168.88.250.1443: Flags [P.], seq 135:226, ack 101, win 802, options [nop,nop,TS val 645677611 ecr 645677605], length 91
08:20:14.244563 IP 192.168.88.250.57926 > 192.168.88.250.1443: Flags [P.], seq 226:511, ack 101, win 802, options [nop,nop,TS val 645677612 ecr 645677605], length 285
08:20:14.244852 IP 192.168.88.250.1443 > 192.168.88.250.57926: Flags [.], ack 511, win 659, options [nop,nop,TS val 645677612 ecr 645677611], length 0
08:20:14.245990 IP 192.168.88.250.1443 > 192.168.88.250.57926: Flags [P.], seq 101:139, ack 511, win 659, options [nop,nop,TS val 645677613 ecr 645677611], length 38
08:20:14.246120 IP 192.168.88.250.1443 > 192.168.88.250.57926: Flags [P.], seq 139:217, ack 511, win 659, options [nop,nop,TS val 645677613 ecr 645677611], length 78
08:20:14.248364 IP 192.168.88.250.57926 > 192.168.88.250.1443: Flags [.], ack 217, win 802, options [nop,nop,TS val 645677615 ecr 645677613], length 0
08:20:14.257955 IP 192.168.88.250.57926 > 192.168.88.250.1443: Flags [P.], seq 511:546, ack 217, win 802, options [nop,nop,TS val 645677625 ecr 645677613], length 35

Each time I complete a transaction, I receive this on the epos server:

打开钱箱成功 USBPrinter{devFile: /dev/usb/lp0, paperWidth: 576, marginBottom: 120}

(Open the cash drawer - although I do not have a cash drawer connected but I have enabled that option in Odoo)

However, there is no error in odoo but nothing prints on my printer. 

Is there something else I can do to understand why this is not working ?

**Comment by xiaohao0576** [comment]
When you plug in your USB Epson TM-T88V printer, please check which file in your `/dev/usb` directory corresponds to the printer. Generally, it's `/dev/usb/lp0`.

You can use the root user to execute `echo "Hello world" > /dev/usb/lp0`

to see if your USB printer prints correctly.

If the `echo` command succeeds, my program should also succeed.

**Comment by xiaohao0576** [comment]
Bug fixed

https://github.com/xiaohao0576/odoo-epos/commit/1c667a41cc9abdd88f907f2c3b07c432244d8d2b
